Date Added,Source,Quote,Author,URL,Status,Notes,HTML,Attribution
2026-02-01T13:37:52,ZenQuotes API,"If you are unable to find the truth right where you are, where else do you expect to find it?",Dogen,https://zenquotes.io/,Needs Review,,"<blockquote>&ldquo;If you are unable to find the truth right where you are, where else do you expect to find it?&rdquo; &mdash; <footer>Dogen</footer></blockquote>",Inspirational quotes provided by ZenQuotes API
2026-02-01T13:37:52,ZenQuotes API,"It takes a minute to have a crush on someone, an hour to like someone, and a day to love someone... but it takes a lifetime to forget someone.",Kahlil Gibran,https://zenquotes.io/,Needs Review,,"<blockquote>&ldquo;It takes a minute to have a crush on someone, an hour to like someone, and a day to love someone... but it takes a lifetime to forget someone.&rdquo; &mdash; <footer>Kahlil Gibran</footer></blockquote>",Inspirational quotes provided by ZenQuotes API
2026-02-01T13:37:52,ZenQuotes API,It is impossible for a man to learn what he thinks he already knows.,Epictetus,https://zenquotes.io/,Needs Review,,<blockquote>&ldquo;It is impossible for a man to learn what he thinks he already knows.&rdquo; &mdash; <footer>Epictetus</footer></blockquote>,Inspirational quotes provided by ZenQuotes API
2026-02-01T13:37:52,ZenQuotes API,The person who never made a mistake never tried anything new.,Albert Einstein,https://zenquotes.io/,Needs Review,,<blockquote>&ldquo;The person who never made a mistake never tried anything new.&rdquo; &mdash; <footer>Albert Einstein</footer></blockquote>,Inspirational quotes provided by ZenQuotes API
2026-02-01T13:37:52,ZenQuotes API,"What a book a devil's chaplain might write on the clumsy, wasteful, blundering, low, and horribly cruel work of nature!",Charles Darwin,https://zenquotes.io/,Needs Review,,"<blockquote>&ldquo;What a book a devil's chaplain might write on the clumsy, wasteful, blundering, low, and horribly cruel work of nature!&rdquo; &mdash; <footer>Charles Darwin</footer></blockquote>",Inspirational quotes provided by ZenQuotes API
2026-02-01T13:37:52,ZenQuotes API,Those who can make you believe absurdities can make you commit atrocities.,Voltaire,https://zenquotes.io/,Needs Review,,<blockquote>&ldquo;Those who can make you believe absurdities can make you commit atrocities. &rdquo; &mdash; <footer>Voltaire</footer></blockquote>,Inspirational quotes provided by ZenQuotes API
2026-02-01T13:37:52,ZenQuotes API,"Do not pray for an easy life, pray for the strength to endure a difficult one.",Bruce Lee,https://zenquotes.io/,Needs Review,,"<blockquote>&ldquo;Do not pray for an easy life, pray for the strength to endure a difficult one.  &rdquo; &mdash; <footer>Bruce Lee</footer></blockquote>",Inspirational quotes provided by ZenQuotes API
2026-02-01T13:37:52,ZenQuotes API,Reality is the leading cause of stress among those in touch with it.,Lily Tomlin,https://zenquotes.io/,Needs Review,,<blockquote>&ldquo;Reality is the leading cause of stress among those in touch with it.&rdquo; &mdash; <footer>Lily Tomlin</footer></blockquote>,Inspirational quotes provided by ZenQuotes API
2026-02-01T13:37:52,ZenQuotes API,Every failure brings with it the seed of an equivalent success.,Napoleon Hill,https://zenquotes.io/,Needs Review,,<blockquote>&ldquo;Every failure brings with it the seed of an equivalent success.&rdquo; &mdash; <footer>Napoleon Hill</footer></blockquote>,Inspirational quotes provided by ZenQuotes API
2026-02-01T13:37:52,ZenQuotes API,"If you don't like something change it; if you can't change it, change the way you think about it.",Mary Engelbreit,https://zenquotes.io/,Needs Review,,"<blockquote>&ldquo;If you don't like something change it; if you can't change it, change the way you think about it.&rdquo; &mdash; <footer>Mary Engelbreit</footer></blockquote>",Inspirational quotes provided by ZenQuotes API
2026-02-01T13:37:52,ZenQuotes API,To bear trials with a calm mind robs misfortune of its strength and burden.,Seneca,https://zenquotes.io/,Needs Review,,<blockquote>&ldquo;To bear trials with a calm mind robs misfortune of its strength and burden.&rdquo; &mdash; <footer>Seneca</footer></blockquote>,Inspirational quotes provided by ZenQuotes API
2026-02-01T13:37:52,ZenQuotes API,"I discovered a long time ago that if I helped enough people get what they wanted, I would always get what I wanted and I would never have to worry.",Tony Robbins,https://zenquotes.io/,Needs Review,,"<blockquote>&ldquo;I discovered a long time ago that if I helped enough people get what they wanted, I would always get what I wanted and I would never have to worry.&rdquo; &mdash; <footer>Tony Robbins</footer></blockquote>",Inspirational quotes provided by ZenQuotes API
2026-02-01T13:37:52,ZenQuotes API,"What do we live for, if it is not to make life less difficult for each other?",George Eliot,https://zenquotes.io/,Needs Review,,"<blockquote>&ldquo;What do we live for, if it is not to make life less difficult for each other?&rdquo; &mdash; <footer>George Eliot</footer></blockquote>",Inspirational quotes provided by ZenQuotes API
2026-02-01T13:37:52,ZenQuotes API,Life is a process. We are a process. The universe is a process.,Anne Wilson Schaef,https://zenquotes.io/,Needs Review,,<blockquote>&ldquo;Life is a process. We are a process. The universe is a process.&rdquo; &mdash; <footer>Anne Wilson Schaef</footer></blockquote>,Inspirational quotes provided by ZenQuotes API
2026-02-01T13:37:52,ZenQuotes API,Numbing the pain for a while will only make it worse when you finally feel it.,Albus Dumbledore,https://zenquotes.io/,Needs Review,,<blockquote>&ldquo;Numbing the pain for a while will only make it worse when you finally feel it.&rdquo; &mdash; <footer>Albus Dumbledore</footer></blockquote>,Inspirational quotes provided by ZenQuotes API
2026-02-01T13:37:52,ZenQuotes API,Take care of your cents: dollars will take care of themselves.,Thomas Jefferson,https://zenquotes.io/,Needs Review,,<blockquote>&ldquo;Take care of your cents: dollars will take care of themselves.&rdquo; &mdash; <footer>Thomas Jefferson</footer></blockquote>,Inspirational quotes provided by ZenQuotes API
2026-02-01T13:37:52,ZenQuotes API,"Most people do not really want freedom, because freedom involves responsibility, and most people are frightened of responsibility.",Sigmund Freud,https://zenquotes.io/,Needs Review,,"<blockquote>&ldquo;Most people do not really want freedom, because freedom involves responsibility, and most people are frightened of responsibility.&rdquo; &mdash; <footer>Sigmund Freud</footer></blockquote>",Inspirational quotes provided by ZenQuotes API
2026-02-01T13:37:52,ZenQuotes API,"A wise man will be master of his mind, a fool will be its slave.",Publilius Syrus,https://zenquotes.io/,Needs Review,,"<blockquote>&ldquo;A wise man will be master of his mind, a fool will be its slave.&rdquo; &mdash; <footer>Publilius Syrus</footer></blockquote>",Inspirational quotes provided by ZenQuotes API
2026-02-01T13:37:52,ZenQuotes API,"The positive thinker sees the invisible, feels the intangible, and achieves the impossible.",Winston Churchill,https://zenquotes.io/,Needs Review,,"<blockquote>&ldquo;The positive thinker sees the invisible, feels the intangible, and achieves the impossible.&rdquo; &mdash; <footer>Winston Churchill</footer></blockquote>",Inspirational quotes provided by ZenQuotes API
2026-02-01T13:37:52,ZenQuotes API,I believe that one of life's greatest risks is never daring to risk.,Oprah Winfrey,https://zenquotes.io/,Needs Review,,<blockquote>&ldquo;I believe that one of life's greatest risks is never daring to risk.&rdquo; &mdash; <footer>Oprah Winfrey</footer></blockquote>,Inspirational quotes provided by ZenQuotes API
2026-02-01T13:37:52,ZenQuotes API,Life isn't about finding yourself. Life is about creating yourself.,George Bernard Shaw,https://zenquotes.io/,Needs Review,,<blockquote>&ldquo;Life isn't about finding yourself. Life is about creating yourself.&rdquo; &mdash; <footer>George Bernard Shaw</footer></blockquote>,Inspirational quotes provided by ZenQuotes API
2026-02-01T13:37:52,ZenQuotes API,"I have not failed. I've just found 10,000 ways that won't work.",Thomas Edison,https://zenquotes.io/,Needs Review,,"<blockquote>&ldquo;I have not failed. I've just found 10,000 ways that won't work.&rdquo; &mdash; <footer>Thomas Edison</footer></blockquote>",Inspirational quotes provided by ZenQuotes API
2026-02-01T13:37:52,ZenQuotes API,"It matters not who you love, where you love, why you love, when you love or how you love, it matters only that you love.",John Lennon,https://zenquotes.io/,Needs Review,,"<blockquote>&ldquo;It matters not who you love, where you love, why you love, when you love or how you love, it matters only that you love.&rdquo; &mdash; <footer>John Lennon</footer></blockquote>",Inspirational quotes provided by ZenQuotes API
2026-02-01T13:37:52,ZenQuotes API,"Excellence is not an exception, it is a prevailing attitude.",Colin Powell,https://zenquotes.io/,Needs Review,,"<blockquote>&ldquo;Excellence is not an exception, it is a prevailing attitude.&rdquo; &mdash; <footer>Colin Powell</footer></blockquote>",Inspirational quotes provided by ZenQuotes API
2026-02-01T13:37:52,ZenQuotes API,The biggest and only critic lives in your perception of people's perception of you rather than people's perception of you.,Criss Jami,https://zenquotes.io/,Needs Review,,<blockquote>&ldquo;The biggest and only critic lives in your perception of people's perception of you rather than people's perception of you.&rdquo; &mdash; <footer>Criss Jami</footer></blockquote>,Inspirational quotes provided by ZenQuotes API
2026-02-01T13:37:52,ZenQuotes API,The majority of what you want will come from the minority of what you do.,Gary Keller,https://zenquotes.io/,Needs Review,,<blockquote>&ldquo;The majority of what you want will come from the minority of what you do.&rdquo; &mdash; <footer>Gary Keller</footer></blockquote>,Inspirational quotes provided by ZenQuotes API
2026-02-01T13:37:52,ZenQuotes API,"The primary point of this existence is to live, and all living things move and grow.",Ming-Dao Deng,https://zenquotes.io/,Needs Review,,"<blockquote>&ldquo;The primary point of this existence is to live, and all living things move and grow.&rdquo; &mdash; <footer>Ming-Dao Deng</footer></blockquote>",Inspirational quotes provided by ZenQuotes API
2026-02-01T13:37:52,ZenQuotes API,Originality is the fine art of remembering what you hear but forgetting where you heard it.,Laurence J. Peter,https://zenquotes.io/,Needs Review,,<blockquote>&ldquo;Originality is the fine art of remembering what you hear but forgetting where you heard it. &rdquo; &mdash; <footer>Laurence J. Peter</footer></blockquote>,Inspirational quotes provided by ZenQuotes API
2026-02-01T13:37:52,ZenQuotes API,If you do not tell the truth about yourself you cannot tell it about other people.,Virginia Woolf,https://zenquotes.io/,Needs Review,,<blockquote>&ldquo;If you do not tell the truth about yourself you cannot tell it about other people.&rdquo; &mdash; <footer>Virginia Woolf</footer></blockquote>,Inspirational quotes provided by ZenQuotes API
