Date Added,Source,Quote,Author,URL,Status,Notes,HTML,Attribution
2025-11-01T13:18:55,ZenQuotes API,Don't let the noise of others' opinions drown out your own inner voice.,Steve Jobs,https://zenquotes.io/,Needs Review,,<blockquote>&ldquo;Don't let the noise of others' opinions drown out your own inner voice.&rdquo; &mdash; <footer>Steve Jobs</footer></blockquote>,Inspirational quotes provided by ZenQuotes API
2025-11-01T13:18:55,ZenQuotes API,One always begins to forgive a place as soon as it's left behind.,Charles Dickens,https://zenquotes.io/,Needs Review,,<blockquote>&ldquo;One always begins to forgive a place as soon as it's left behind.&rdquo; &mdash; <footer>Charles Dickens</footer></blockquote>,Inspirational quotes provided by ZenQuotes API
2025-11-01T13:18:55,ZenQuotes API,"When reading, only read. When eating, only eat. When thinking, only think.",Seungsahn,https://zenquotes.io/,Needs Review,,"<blockquote>&ldquo;When reading, only read. When eating, only eat. When thinking, only think.&rdquo; &mdash; <footer>Seungsahn</footer></blockquote>",Inspirational quotes provided by ZenQuotes API
2025-11-01T13:18:55,ZenQuotes API,"If you don't like something change it. If you can't change it, change your attitude about it. Don't complain.",Maya Angelou,https://zenquotes.io/,Needs Review,,"<blockquote>&ldquo;If you don't like something change it. If you can't change it, change your attitude about it. Don't complain.&rdquo; &mdash; <footer>Maya Angelou</footer></blockquote>",Inspirational quotes provided by ZenQuotes API
2025-11-01T13:18:55,ZenQuotes API,You can never cross the ocean unless you have the courage to lose sight of the shore.,Christopher Columbus,https://zenquotes.io/,Needs Review,,<blockquote>&ldquo;You can never cross the ocean unless you have the courage to lose sight of the shore.&rdquo; &mdash; <footer>Christopher Columbus</footer></blockquote>,Inspirational quotes provided by ZenQuotes API
2025-11-01T13:18:55,ZenQuotes API,"All our dreams can come true, if we have the courage to pursue them.",Walt Disney,https://zenquotes.io/,Needs Review,,"<blockquote>&ldquo;All our dreams can come true, if we have the courage to pursue them.&rdquo; &mdash; <footer>Walt Disney</footer></blockquote>",Inspirational quotes provided by ZenQuotes API
2025-11-01T13:18:55,ZenQuotes API,"The more rejection you get, the better you are, the more you've learned, the closer you are to your outcome.",Tony Robbins,https://zenquotes.io/,Needs Review,,"<blockquote>&ldquo;The more rejection you get, the better you are, the more you've learned, the closer you are to your outcome.&rdquo; &mdash; <footer>Tony Robbins</footer></blockquote>",Inspirational quotes provided by ZenQuotes API
2025-11-01T13:18:55,ZenQuotes API,"Reflect upon your present blessings of which every man has many - not on your past misfortunes, of which all men have some.",Charles Dickens,https://zenquotes.io/,Needs Review,,"<blockquote>&ldquo;Reflect upon your present blessings of which every man has many - not on your past misfortunes, of which all men have some.&rdquo; &mdash; <footer>Charles Dickens</footer></blockquote>",Inspirational quotes provided by ZenQuotes API
2025-11-01T13:18:55,ZenQuotes API,The danger of an adventure is worth a thousand days of ease and comfort.,Paulo Coelho,https://zenquotes.io/,Needs Review,,<blockquote>&ldquo;The danger of an adventure is worth a thousand days of ease and comfort.&rdquo; &mdash; <footer>Paulo Coelho</footer></blockquote>,Inspirational quotes provided by ZenQuotes API
2025-11-01T13:18:55,ZenQuotes API,One of the oldest human needs is having someone to wonder where you are when you don't come home at night.,Margaret Mead,https://zenquotes.io/,Needs Review,,<blockquote>&ldquo;One of the oldest human needs is having someone to wonder where you are when you don't come home at night. &rdquo; &mdash; <footer>Margaret Mead</footer></blockquote>,Inspirational quotes provided by ZenQuotes API
2025-11-01T13:18:55,ZenQuotes API,"You were born to win, but to be a winner you must plan to win, prepare to win, and expect to win.",Zig Ziglar,https://zenquotes.io/,Needs Review,,"<blockquote>&ldquo;You were born to win, but to be a winner you must plan to win, prepare to win, and expect to win.&rdquo; &mdash; <footer>Zig Ziglar</footer></blockquote>",Inspirational quotes provided by ZenQuotes API
2025-11-01T13:18:55,ZenQuotes API,Optimism is the faith that leads to achievement. Nothing can be done without hope and confidence.,Helen Keller,https://zenquotes.io/,Needs Review,,<blockquote>&ldquo;Optimism is the faith that leads to achievement. Nothing can be done without hope and confidence.&rdquo; &mdash; <footer>Helen Keller</footer></blockquote>,Inspirational quotes provided by ZenQuotes API
2025-11-01T13:18:55,ZenQuotes API,"You are not the drop in the ocean, but the ocean in the drop.",Deepak Chopra,https://zenquotes.io/,Needs Review,,"<blockquote>&ldquo;You are not the drop in the ocean, but the ocean in the drop.&rdquo; &mdash; <footer>Deepak Chopra</footer></blockquote>",Inspirational quotes provided by ZenQuotes API
2025-11-01T13:18:55,ZenQuotes API,It's the possibility of having a dream come true that makes life interesting.,Paulo Coelho,https://zenquotes.io/,Needs Review,,<blockquote>&ldquo;It's the possibility of having a dream come true that makes life interesting.&rdquo; &mdash; <footer>Paulo Coelho</footer></blockquote>,Inspirational quotes provided by ZenQuotes API
2025-11-01T13:18:55,ZenQuotes API,There are no accidents... there is only some purpose that we haven't yet understood.,Deepak Chopra,https://zenquotes.io/,Needs Review,,<blockquote>&ldquo;There are no accidents... there is only some purpose that we haven't yet understood.&rdquo; &mdash; <footer>Deepak Chopra</footer></blockquote>,Inspirational quotes provided by ZenQuotes API
2025-11-01T13:18:55,ZenQuotes API,"There are no constraints on the human mind, no walls around the human spirit, no barriers to our progress except those we ourselves erect.",Ronald Reagan,https://zenquotes.io/,Needs Review,,"<blockquote>&ldquo;There are no constraints on the human mind, no walls around the human spirit, no barriers to our progress except those we ourselves erect.&rdquo; &mdash; <footer>Ronald Reagan</footer></blockquote>",Inspirational quotes provided by ZenQuotes API
2025-11-01T13:18:55,ZenQuotes API,"You have to accept whatever comes, and the only important thing is that you meet it with the best you have to give.",Eleanor Roosevelt,https://zenquotes.io/,Needs Review,,"<blockquote>&ldquo;You have to accept whatever comes, and the only important thing is that you meet it with the best you have to give.&rdquo; &mdash; <footer>Eleanor Roosevelt</footer></blockquote>",Inspirational quotes provided by ZenQuotes API
2025-11-01T13:18:55,ZenQuotes API,"The most important thing in life is to stop saying 'I wish' and start saying 'I will'. Consider nothing impossible, then treat possibilities as probabilities.",Charles Dickens,https://zenquotes.io/,Needs Review,,"<blockquote>&ldquo;The most important thing in life is to stop saying 'I wish' and start saying 'I will'. Consider nothing impossible, then treat possibilities as probabilities.&rdquo; &mdash; <footer>Charles Dickens</footer></blockquote>",Inspirational quotes provided by ZenQuotes API
2025-11-01T13:18:55,ZenQuotes API,"Old age is like everything else. To make a success of it, you've got to start young.",Theodore Roosevelt,https://zenquotes.io/,Needs Review,,"<blockquote>&ldquo;Old age is like everything else. To make a success of it, you've got to start young.&rdquo; &mdash; <footer>Theodore Roosevelt</footer></blockquote>",Inspirational quotes provided by ZenQuotes API
2025-11-01T13:18:55,ZenQuotes API,"The unthankful heart discovers no mercies; but the thankful heart will find, in every hour, some heavenly blessings.",Henry Ward Beecher,https://zenquotes.io/,Needs Review,,"<blockquote>&ldquo;The unthankful heart discovers no mercies; but the thankful heart will find, in every hour, some heavenly blessings.&rdquo; &mdash; <footer>Henry Ward Beecher</footer></blockquote>",Inspirational quotes provided by ZenQuotes API
2025-11-01T13:18:55,ZenQuotes API,"Grudges are for those who insist that they are owed something; forgiveness, however, is for those who are substantial enough to move on.",Criss Jami,https://zenquotes.io/,Needs Review,,"<blockquote>&ldquo;Grudges are for those who insist that they are owed something; forgiveness, however, is for those who are substantial enough to move on.&rdquo; &mdash; <footer>Criss Jami</footer></blockquote>",Inspirational quotes provided by ZenQuotes API
2025-11-01T13:18:55,ZenQuotes API,We crave for new sensations but soon become indifferent to them. The wonders of yesterday are today common occurrences,Nikola Tesla,https://zenquotes.io/,Needs Review,,<blockquote>&ldquo;We crave for new sensations but soon become indifferent to them. The wonders of yesterday are today common occurrences &rdquo; &mdash; <footer>Nikola Tesla</footer></blockquote>,Inspirational quotes provided by ZenQuotes API
2025-11-01T13:18:55,ZenQuotes API,There is nothing like looking if you want to find something.,J.R.R. Tolkien,https://zenquotes.io/,Needs Review,,<blockquote>&ldquo;There is nothing like looking if you want to find something.&rdquo; &mdash; <footer>J.R.R. Tolkien</footer></blockquote>,Inspirational quotes provided by ZenQuotes API
2025-11-01T13:18:55,ZenQuotes API,"Pleasure is always derived from something outside you, whereas joy arises from within.",Eckhart Tolle,https://zenquotes.io/,Needs Review,,"<blockquote>&ldquo;Pleasure is always derived from something outside you, whereas joy arises from within. &rdquo; &mdash; <footer>Eckhart Tolle</footer></blockquote>",Inspirational quotes provided by ZenQuotes API
2025-11-01T13:18:55,ZenQuotes API,Logic is like the sword - those who appeal to it shall perish by it.,Samuel Butler,https://zenquotes.io/,Needs Review,,<blockquote>&ldquo;Logic is like the sword - those who appeal to it shall perish by it.&rdquo; &mdash; <footer>Samuel Butler</footer></blockquote>,Inspirational quotes provided by ZenQuotes API
2025-11-01T13:18:55,ZenQuotes API,"In order to carry a positive action, we must develop here a positive vision.",Dalai Lama,https://zenquotes.io/,Needs Review,,"<blockquote>&ldquo;In order to carry a positive action, we must develop here a positive vision.&rdquo; &mdash; <footer>Dalai Lama</footer></blockquote>",Inspirational quotes provided by ZenQuotes API
2025-11-01T13:18:55,ZenQuotes API,Getting over a painful experience is much like crossing monkey bars. You have to let go at some point in order to move forward.,Unknown,https://zenquotes.io/,Needs Review,,<blockquote>&ldquo;Getting over a painful experience is much like crossing monkey bars. You have to let go at some point in order to move forward.&rdquo; &mdash; <footer>Unknown</footer></blockquote>,Inspirational quotes provided by ZenQuotes API
2025-11-01T13:18:55,ZenQuotes API,Don't change your mind just because people are offended; change your mind if you're wrong.,Criss Jami,https://zenquotes.io/,Needs Review,,<blockquote>&ldquo;Don't change your mind just because people are offended; change your mind if you're wrong.&rdquo; &mdash; <footer>Criss Jami</footer></blockquote>,Inspirational quotes provided by ZenQuotes API
2025-11-01T13:18:55,ZenQuotes API,You are a function of what the whole universe is doing in the same way that a wave is a function of what the whole ocean is doing.,Alan Watts,https://zenquotes.io/,Needs Review,,<blockquote>&ldquo;You are a function of what the whole universe is doing in the same way that a wave is a function of what the whole ocean is doing.&rdquo; &mdash; <footer>Alan Watts</footer></blockquote>,Inspirational quotes provided by ZenQuotes API
2025-11-01T13:18:55,ZenQuotes API,Just try to be the best you can be; never cease trying to be the best you can be. That's in your power.,John Wooden,https://zenquotes.io/,Needs Review,,<blockquote>&ldquo;Just try to be the best you can be; never cease trying to be the best you can be. That's in your power.&rdquo; &mdash; <footer>John Wooden</footer></blockquote>,Inspirational quotes provided by ZenQuotes API
2025-11-01T13:18:55,ZenQuotes API,"Mistakes are painful when they happen, but years later a collection of mistakes is what is called experience.",Denis Waitley,https://zenquotes.io/,Needs Review,,"<blockquote>&ldquo;Mistakes are painful when they happen, but years later a collection of mistakes is what is called experience.&rdquo; &mdash; <footer>Denis Waitley</footer></blockquote>",Inspirational quotes provided by ZenQuotes API
2025-11-01T13:18:55,ZenQuotes API,It is the mark of an educated mind to be able to entertain a thought without accepting it.,Aristotle,https://zenquotes.io/,Needs Review,,<blockquote>&ldquo;It is the mark of an educated mind to be able to entertain a thought without accepting it.&rdquo; &mdash; <footer>Aristotle</footer></blockquote>,Inspirational quotes provided by ZenQuotes API
2025-11-01T13:18:55,ZenQuotes API,Small men think they are small; great men never know they are great.,Chinese Proverb,https://zenquotes.io/,Needs Review,,<blockquote>&ldquo;Small men think they are small; great men never know they are great. &rdquo; &mdash; <footer>Chinese Proverb</footer></blockquote>,Inspirational quotes provided by ZenQuotes API
2025-11-01T13:18:55,ZenQuotes API,A man with outward courage dares to die: a man with inner courage dares to live.,Lao Tzu,https://zenquotes.io/,Needs Review,,<blockquote>&ldquo;A man with outward courage dares to die: a man with inner courage dares to live.&rdquo; &mdash; <footer>Lao Tzu</footer></blockquote>,Inspirational quotes provided by ZenQuotes API
2025-11-01T13:18:55,ZenQuotes API,I never dwell on what happened. You can't change it. Move forward.,Joan Rivers,https://zenquotes.io/,Needs Review,,<blockquote>&ldquo;I never dwell on what happened. You can't change it. Move forward.&rdquo; &mdash; <footer>Joan Rivers</footer></blockquote>,Inspirational quotes provided by ZenQuotes API
